Date,Incident,Theme,Ingress Issue,Root Cause,Probable Cause Category,Slack Thread Link
2026-02-09,Feb 9 /api/v1/users 500 (scrt2-interaction),Invalid path handling in prod vs test,No,IG logs show upstream responses; behavior driven by service/config differences,Service Behavior/Config,https://salesforce-internal.slack.com/archives/CT6U3FZ17/p1770891996269289?thread_ts=1770891996.269289&cid=CT6U3FZ17
2026-01-08,IG incident (dev1/dev4 404),Ingress routing 404 in dev clusters,Yes,Ingress incident impacting dev clusters; resolved after incident,Ingress Platform Outage,https://salesforce-internal.slack.com/archives/CT6U3FZ17/p1767852008519769?thread_ts=1767852008.519769&cid=CT6U3FZ17
2026-01-08,ICC-86911295 (dev2 mesh endpoints down),Mesh endpoints down in dev2,No,Follow-up identified KMS DB issue in dev2,Dependency/DB,https://salesforce-internal.slack.com/archives/CT6U3FZ17/p1767853328452029?thread_ts=1767853328.452029&cid=CT6U3FZ17
2026-01-08,IG incident (uip001 404),Ingress 404 for bdmpresto-superset,Yes,IG incident referenced in announcement; resolved,Ingress Platform Outage,https://salesforce-internal.slack.com/archives/CT6U3FZ17/p1767870592095989?thread_ts=1767870592.095989&cid=CT6U3FZ17
2026-01-07,Temporal UI dev incident,Ingress-gateway team paged; UI unreachable,Yes,Incident created and IG team paged for dev clusters,Ingress Platform Outage,https://salesforce-internal.slack.com/archives/CT6U3FZ17/p1767846606552309?thread_ts=1767846606.552309&cid=CT6U3FZ17
2026-01-08,IG incident (delegate mismatch),Ingress delegate misconfigured; 404 route_not_found,Yes,Wrong delegate in VS; fixed by rebuilding VS,Routing/Config,https://salesforce-internal.slack.com/archives/CT6U3FZ17/p1768141641044539?thread_ts=1768141641.044539&cid=CT6U3FZ17
2026-01-08,Mesh analyzer down during incident,No healthy upstream; argo rollout degraded,No,Argo rollout/DR pod hash stuck; service rollout bug,Deployment/Rollout,https://salesforce-internal.slack.com/archives/CT6U3FZ17/p1767833433266119?thread_ts=1767833433.266119&cid=CT6U3FZ17
